{"id":"demo","createdAt":"2026-10-10T21:04:11.123Z","engine":"2be4fcd","bots":["random-a","random-b"],"gamesPerPairing":2,"games":[{"id":"random-a-vs-random-b-1","seed":1,"p1":"random-a","p2":"random-b","winner":"random-b","winnerSeat":"p2","rounds":14,"steps":594,"outcome":"won","error":null,"ms":3120},{"id":"random-b-vs-random-a-2","seed":2,"p1":"random-b","p2":"random-a","winner":null,"winnerSeat":null,"rounds":0,"steps":0,"outcome":"running","error":null,"ms":0}]}
